{
  "doc": "Rifle shot: tight snappy crack (fires 10/s).",
  "gain": 0.6,
  "pitchVariation": 0.07,
  "maxVoices": 6,
  "layers": [
    {
      "wave": "noise",
      "env": { "attack": 0.001, "decay": 0.06, "release": 0.06, "curve": 3 },
      "filter": { "type": "lowpass", "freq": 7000, "freqEnd": 1200 }
    },
    {
      "wave": "sine",
      "freq": 200,
      "freqEnd": 70,
      "env": { "attack": 0.001, "decay": 0.07, "release": 0.03 },
      "gain": 0.7
    }
  ],
  "fx": { "drive": 0.3, "reverb": 0.1 }
}
