{
  "doc": "Music drum: punchy kick (unpitched hit).",
  "gain": 1,
  "bus": "music",
  "layers": [
    {
      "wave": "sine",
      "freq": 140,
      "freqEnd": 45,
      "glide": 0.08,
      "env": { "attack": 0.001, "decay": 0.28, "release": 0.05 }
    },
    {
      "wave": "noise",
      "env": { "attack": 0.0005, "decay": 0.01, "release": 0.005 },
      "filter": { "freq": 3000 },
      "gain": 0.3
    }
  ]
}
