{
  "doc": "Rocket launch: whooshing ignition.",
  "gain": 0.7,
  "layers": [
    {
      "wave": "noise",
      "env": { "attack": 0.01, "decay": 0.4, "release": 0.3 },
      "filter": { "type": "bandpass", "freq": 600, "freqEnd": 2400, "q": 0.8 }
    },
    {
      "wave": "saw",
      "freq": 90,
      "freqEnd": 60,
      "env": { "attack": 0.005, "decay": 0.2, "release": 0.1 },
      "filter": { "freq": 500 },
      "gain": 0.5
    }
  ],
  "fx": { "drive": 0.2, "reverb": 0.2 }
}
