{
  "doc": "Bright two-note chime for collecting items.",
  "gain": 0.6,
  "bus": "ui",
  "layers": [
    { "wave": "triangle", "freq": 880, "env": { "attack": 0.002, "decay": 0.06, "release": 0.03 } },
    {
      "wave": "triangle",
      "freq": 1318.5,
      "delay": 0.07,
      "env": { "attack": 0.002, "decay": 0.12, "release": 0.1 }
    }
  ],
  "fx": { "echoTime": 0.09, "echoMix": 0.25 }
}
